Date,Day,Summary
2026-02-16,Monday,Merged Bruno API client collection feature and managed multiple PRs across dataapi and datamap repositories.
2026-02-12,Thursday,Merged pull requests adding catalog API endpoints for listing node and relationship types in the datamap project.
2026-02-11,Wednesday,"Enhanced the datamap API with comprehensive Bruno test collection setup, bug fixes, and access control improvements."
2026-02-10,Tuesday,"Integrated Bruno API client with authentication, environment configurations, and OpenAPI synchronization across multiple feature branches."
2026-02-09,Monday,Merged pull request #235 for martin-started-at feature and created new maerin-revision branch for continued development.
2026-02-06,Friday,"Completed multiple pull requests improving CI tooling, Neo4j error handling, and database record processing."
2026-02-05,Thursday,"Enhanced datamap with source metadata tracking, schema filtering improvements, and system cleanup through multiple merged pull requests."
2026-02-04,Wednesday,"Refactored schema management system with improved organization, metadata validation, and streamlined upload workflows for the datamap project."
2026-02-03,Tuesday,"Merged multiple pull requests for datamap including Neo4j integration and CI workflow improvements, plus started new Gustav project."
2026-02-02,Monday,Created initial feature branch for Gustav project and completed three code reviews for the datamap repository.
2026-01-31,Saturday,Reviewed four pull requests for the Dius-ai/datamap project to ensure code quality and maintainability.
2026-01-29,Thursday,"Reviewed 14 pull requests on the Dius-ai/datamap project, focusing on code quality and collaboration."
2026-01-28,Wednesday,Merged two pull requests removing mining job functionality and freezing Apicurio image versions in the datamap project.
2026-01-27,Tuesday,Merged an instance list accent fix and actively reviewed PRs while contributing to Neo4j database integration discussions.
2026-01-26,Monday,Merged martin-group-schemas feature and conducted extensive code reviews across multiple pull requests in the datamap project.
2026-01-21,Wednesday,Merged two pull requests for datamap mining functionality including scheduling capabilities.
2026-01-20,Tuesday,Merged pull request #183 for instance validation functionality in the datamap project.
